{"v":2,"eventId":"aaaaaaaaaaaaaaaaaaaaaaaa","serverTick":0,"serverTimeMs":1793340000000,"type":"blaster.snapshot","payload":{"matchId":"00000000-0000-4000-8000-000000000001","phase":"playing","frame":3599,"serverTimeMs":1793340000000,"startsAt":1793339820000,"deadlineAt":1793340000000,"wave":3,"actors":[{"actorId":"00000000-0000-4000-8000-000000000000","actorType":"human","userId":"00000000-0000-4000-8000-000000000000","displayName":"\u003c\u003c\u003c\u003c\u003c\u003c\u003c\u003c\u003c\u003c\u003c\u003c\u003c\u003c\u003c\u003c\u003c\u003c\u003c\u003c\u003c\u003c\u003c\u003c\u003c\u003c\u003c\u003c\u003c\u003c\u003c\u003c","avatarId":"pumpkin"},{"actorId":"00000000-0000-4000-8000-000000000001","actorType":"human","userId":"00000000-0000-4000-8000-000000000001","displayName":"\u003c\u003c\u003c\u003c\u003c\u003c\u003c\u003c\u003c\u003c\u003c\u003c\u003c\u003c\u003c\u003c\u003c\u003c\u003c\u003c\u003c\u003c\u003c\u003c\u003c\u003c\u003c\u003c\u003c\u003c\u003c\u003c","avatarId":"pumpkin"},{"actorId":"00000000-0000-4000-8000-000000000002","actorType":"human","userId":"00000000-0000-4000-8000-000000000002","displayName":"\u003c\u003c\u003c\u003c\u003c\u003c\u003c\u003c\u003c\u003c\u003c\u003c\u003c\u003c\u003c\u003c\u003c\u003c\u003c\u003c\u003c\u003c\u003c\u003c\u003c\u003c\u003c\u003c\u003c\u003c\u003c\u003c","avatarId":"pumpkin"},{"actorId":"00000000-0000-4000-8000-000000000003","actorType":"human","userId":"00000000-0000-4000-8000-000000000003","displayName":"\u003c\u003c\u003c\u003c\u003c\u003c\u003c\u003c\u003c\u003c\u003c\u003c\u003c\u003c\u003c\u003c\u003c\u003c\u003c\u003c\u003c\u003c\u003c\u003c\u003c\u003c\u003c\u003c\u003c\u003c\u003c\u003c","avatarId":"pumpkin"}],"players":[{"actorId":"00000000-0000-4000-8000-000000000000","x":0,"y":0.513,"aim":3.142,"hp":3,"kills":8,"hitAt":1793340000000},{"actorId":"00000000-0000-4000-8000-000000000001","x":0.841,"y":0.513,"aim":3.142,"hp":3,"kills":8,"hitAt":1793340000000},{"actorId":"00000000-0000-4000-8000-000000000002","x":0.909,"y":0.513,"aim":3.142,"hp":3,"kills":8,"hitAt":1793340000000},{"actorId":"00000000-0000-4000-8000-000000000003","x":0.141,"y":0.513,"aim":3.142,"hp":3,"kills":8,"hitAt":1793340000000}],"bots":[{"id":100,"x":0.413,"y":0.513},{"id":101,"x":0.413,"y":0.513},{"id":102,"x":0.413,"y":0.513},{"id":103,"x":0.413,"y":0.513},{"id":104,"x":0.413,"y":0.513},{"id":105,"x":0.413,"y":0.513},{"id":106,"x":0.413,"y":0.513},{"id":107,"x":0.413,"y":0.513}],"projectiles":[[1000,0.413,0.513,-1],[1001,0.413,0.513,0],[1002,0.413,0.513,1],[1003,0.413,0.513,2],[1004,0.413,0.513,3],[1005,0.413,0.513,-1],[1006,0.413,0.513,0],[1007,0.413,0.513,1],[1008,0.413,0.513,2],[1009,0.413,0.513,3],[1010,0.413,0.513,-1],[1011,0.413,0.513,0],[1012,0.413,0.513,1],[1013,0.413,0.513,2],[1014,0.413,0.513,3],[1015,0.413,0.513,-1],[1016,0.413,0.513,0],[1017,0.413,0.513,1],[1018,0.413,0.513,2],[1019,0.413,0.513,3],[1020,0.413,0.513,-1],[1021,0.413,0.513,0],[1022,0.413,0.513,1],[1023,0.413,0.513,2],[1024,0.413,0.513,3],[1025,0.413,0.513,-1],[1026,0.413,0.513,0],[1027,0.413,0.513,1],[1028,0.413,0.513,2],[1029,0.413,0.513,3],[1030,0.413,0.513,-1],[1031,0.413,0.513,0],[1032,0.413,0.513,1],[1033,0.413,0.513,2],[1034,0.413,0.513,3],[1035,0.413,0.513,-1],[1036,0.413,0.513,0],[1037,0.413,0.513,1],[1038,0.413,0.513,2],[1039,0.413,0.513,3],[1040,0.413,0.513,-1],[1041,0.413,0.513,0],[1042,0.413,0.513,1],[1043,0.413,0.513,2],[1044,0.413,0.513,3],[1045,0.413,0.513,-1],[1046,0.413,0.513,0],[1047,0.413,0.513,1]]}}
